<?xml version="1.0" encoding="UTF-8"?>
<!--
To change this template, choose Tools | Templates
and open the template in the editor.
-->


<ns1:bd
    xmlns:xsi='http://www.w3.org/2001/XMLSchema-instance'
    xmlns:ns1='http://univ-rouen.fr/bd'
    xsi:schemaLocation='http://univ-rouen.fr/bd bd.xsd'
    ns1:isbn="9781401240936" ns1:planches="40" ns1:langue="FR" ns1:serie=""> 
    <titre>Hellblazer Death and cigarettes</titre>
    <numero>1.0</numero>
    <informations></informations>
    <depotLegal>2013-04</depotLegal>
    <finImpression>2013-04</finImpression>
    <parution>2013-03-19</parution>
    <editeur>Planeta DeAgostini</editeur>
    <resume>John Constantine had no intention of tracking down his long-lost nephew, despite the promise John made to his dead mom. But mysterious circumstances and a series of murders set Constantine out to Ireland in search of his forgotten relative. However, after a s√©ance with his late sister Cheryl, Constantine finds that there might be a lot more connections between his nephew and these set of murders than meets the eye.
        In this penultimate chapter to Vertigo's longest series, Death and Cigarettes is the latest chapter in critically acclaimed writer Peter Milligan's run on HELLBLAZER.
    </resume>
    <format>Format comics</format>
    <creation>2013-03-19</creation>
    <image>http://www.bedetheque.com/thb_couv/Couv_185426.jpg</image>
    <ns1:scenaristes>
        <ns1:scenariste>
            <ns1:nom>Milligan</ns1:nom>
            <ns1:prenom>Pete</ns1:prenom>
        </ns1:scenariste>
    </ns1:scenaristes>
    <ns1:dessinateurs>
        <ns1:dessinateur>
            <ns1:nom>Camuncoli</ns1:nom>
            <ns1:prenom>Giuseppe</ns1:prenom>
        </ns1:dessinateur>
        <ns1:dessinateur>
            <ns1:nom>test</ns1:nom>
            <ns1:prenom>test</ns1:prenom>
        </ns1:dessinateur>
        <ns1:dessinateur>
            <ns1:nom>Camuncoli</ns1:nom>
            <ns1:prenom>Giuseppe</ns1:prenom>
        </ns1:dessinateur>
        <ns1:dessinateur>
            <ns1:nom>test</ns1:nom>
            <ns1:prenom>test</ns1:prenom>
        </ns1:dessinateur>
        <ns1:dessinateur>
            <ns1:nom>Camuncoli</ns1:nom>
            <ns1:prenom>Giuseppe</ns1:prenom>
        </ns1:dessinateur>
        <ns1:dessinateur>
            <ns1:nom>test</ns1:nom>
            <ns1:prenom>test</ns1:prenom>
        </ns1:dessinateur>
    </ns1:dessinateurs>
    <ns1:coloristes>
        <ns1:coloriste>
            <ns1:nom>Buccellato</ns1:nom>
            <ns1:prenom>Brian</ns1:prenom>
        </ns1:coloriste>
        <ns1:coloriste>
            <ns1:nom>test</ns1:nom>
            <ns1:prenom>test</ns1:prenom>
        </ns1:coloriste>
    </ns1:coloristes>
    <ns1:lettrages>
        <ns1:lettrage>
            <ns1:nom>test3</ns1:nom>
            <ns1:prenom>test3</ns1:prenom>
        </ns1:lettrage>
    </ns1:lettrages>
    <ns1:encrages>
        <ns1:encrage>
            <ns1:nom>test4</ns1:nom>
            <ns1:prenom>test4</ns1:prenom>
        </ns1:encrage>
        <ns1:encrage>
            <ns1:nom>test5</ns1:nom>
            <ns1:prenom>test5</ns1:prenom>
        </ns1:encrage>
    </ns1:encrages>
    <ns1:tome>
        <ns1:numero>300</ns1:numero>
        <ns1:informations></ns1:informations>
    </ns1:tome>

</ns1:bd>
