<?xml version="1.0" encoding="UTF-8"?>
<ns1:bd
    xmlns:xsi='http://www.w3.org/2001/XMLSchema-instance'
    xmlns:ns1='http://univ-rouen.fr/bd'
    xsi:schemaLocation='http://univ-rouen.fr/bd bd.xsd'
    ns1:isbn="2746031701" ns1:planches="160 " ns1:langue="FR" ns1:serie="">
    <ns1:titre>Batman-Sombre reflet</ns1:titre>
    <ns1:depotLegal>2012-04</ns1:depotLegal>
    <ns1:finImpression>2012-03</ns1:finImpression>
    <ns1:parution>2012-04-11</ns1:parution>
    <ns1:editeur>Urban Comics</ns1:editeur>
    <ns1:resume>Tandis que le retour de James Gordon Jr. ravive les tensions au sein de son entourage et rouvre des cicatrices, Batman rencontre la fille du responsable de la mort de ses parents ! Tiraillé entre son attirance pour la jeune femme et son désir de vengeance, le chevalier noir a bien du mal à mener son enquête à terme. Et lorsque le Joker se joint à la danse, la tension monte d’un cran et vengeances et trahisons s’enchaînent à un rythme étouffant !</ns1:resume>
    <ns1:format>Format comics</ns1:format>
    <ns1:creationDate>2012-04-08</ns1:creationDate>
    <ns1:image>http://www.bedetheque.com/thb_couv/Couv_160824.jpg</ns1:image>
    <ns1:scenaristes>
        <ns1:scenariste>
            <ns1:nom>Snyder</ns1:nom>
            <ns1:prenom>Scott</ns1:prenom>
        </ns1:scenariste>
    </ns1:scenaristes>
    <ns1:dessinateurs>
        <ns1:dessinateur>
            <ns1:nom>Jock</ns1:nom>
            <ns1:prenom></ns1:prenom>
        </ns1:dessinateur>
        <ns1:dessinateur>
            <ns1:nom>Francavilla</ns1:nom>
            <ns1:prenom>Francesco</ns1:prenom>
        </ns1:dessinateur>
    </ns1:dessinateurs>
    <ns1:coloristes>
        <ns1:coloriste>
            <ns1:nom>Baron</ns1:nom>
            <ns1:prenom>David</ns1:prenom>
        </ns1:coloriste>
    </ns1:coloristes>
    <ns1:tome>
        <ns1:numero>2</ns1:numero>
        <ns1:informations></ns1:informations>
    </ns1:tome>

</ns1:bd>
